[{"id":2768188,"name":"Alaska Pollock, raw","cat":"Finfish and Shellfish Products","kcal":78.5,"protein":17.33,"fat":0.9925,"carbs":0.0565,"fiber":0,"sodium":114.8,"portions":[]},{"id":2262074,"name":"Almond butter, creamy","cat":"Nut and Seed Products","kcal":645.5,"protein":20.78734,"fat":53.04,"carbs":21.23666,"fiber":9.718,"sodium":0.9963,"portions":[]},{"id":2257045,"name":"Almond milk, unsweetened, plain, refrigerated","cat":"Beverages","kcal":19.3,"protein":0.65625,"fat":1.558,"carbs":0.67075,"fiber":0,"sodium":59.22,"portions":[]},{"id":1999631,"name":"Almond milk, unsweetened, plain, shelf stable","cat":"Beverages","kcal":14.6,"protein":0.5546875,"fat":1.221,"carbs":0.3371125,"fiber":0,"sodium":59.58,"portions":[]},{"id":2747652,"name":"Anchovies, canned in olive oil, with salt, drained","cat":"Finfish and Shellfish Products","kcal":206.1,"protein":26.9375,"fat":9.853,"carbs":2.4095,"fiber":null,"sodium":5403,"portions":[]},{"id":2003590,"name":"Apple juice, with added vitamin C, from concentrate, shelf stable","cat":"Fruits and Fruit Juices","kcal":48.4,"protein":0.0859375,"fat":0.2863,"carbs":11.3639625,"fiber":null,"sodium":4.872,"portions":[]},{"id":1750340,"name":"Apples, fuji, with skin, raw","cat":"Fruits and Fruit Juices","kcal":64.7,"protein":0.1484375,"fat":0.1625,"carbs":15.6511625,"fiber":2.075,"sodium":1.013,"portions":[{"amount":1,"unit":"serving","grams":140}]},{"id":1750341,"name":"Apples, gala, with skin, raw","cat":"Fruits and Fruit Juices","kcal":61,"protein":0.1328125,"fat":0.15,"carbs":14.7680875,"fiber":2.109,"sodium":0.2788,"portions":[{"amount":1,"unit":"serving","grams":140}]},{"id":1750342,"name":"Apples, granny smith, with skin, raw","cat":"Fruits and Fruit Juices","kcal":58.9,"protein":0.265625,"fat":0.1375,"carbs":14.142975,"fiber":2.514,"sodium":0,"portions":[{"amount":1,"unit":"serving","grams":140}]},{"id":1750343,"name":"Apples, honeycrisp, with skin, raw","cat":"Fruits and Fruit Juices","kcal":60,"protein":0.1015625,"fat":0.1,"carbs":14.6819375,"fiber":1.721,"sodium":0.1375,"portions":[{"amount":1,"unit":"serving","grams":140}]},{"id":1750339,"name":"Apples, red delicious, with skin, raw","cat":"Fruits and Fruit Juices","kcal":61.8,"protein":0.1875,"fat":0.2125,"carbs":14.7817,"fiber":2.043,"sodium":0,"portions":[{"amount":1,"unit":"serving","grams":140}]},{"id":2346414,"name":"Applesauce, unsweetened, with added vitamin C","cat":"Fruits and Fruit Juices","kcal":51.6,"protein":0.2734375,"fat":0.1625,"carbs":12.2615625,"fiber":null,"sodium":0.5038,"portions":[{"amount":1,"unit":"serving","grams":140}]},{"id":2710815,"name":"Apricot, with skin, raw","cat":"Fruits and Fruit Juices","kcal":48.4,"protein":0.96125,"fat":0.405,"carbs":10.23875,"fiber":1.51,"sodium":0,"portions":[{"amount":1,"unit":"serving","grams":140}]},{"id":2710822,"name":"Arugula, baby, raw","cat":"Vegetables and Vegetable Products","kcal":31,"protein":1.64875,"fat":0.325,"carbs":5.36825,"fiber":2.28,"sodium":86.93,"portions":[{"amount":1,"unit":"serving","grams":85}]},{"id":2710823,"name":"Asparagus, green, raw","cat":"Vegetables and Vegetable Products","kcal":28.1,"protein":1.4375,"fat":0.2163,"carbs":5.1012,"fiber":1.883,"sodium":2.46,"portions":[{"amount":1,"unit":"serving","grams":85}]},{"id":2710824,"name":"Avocado, Hass, peeled, raw","cat":"Fruits and Fruit Juices","kcal":223.3,"protein":1.8125,"fat":20.31,"carbs":8.3235,"fiber":null,"sodium":0,"portions":[{"amount":1,"unit":"serving","grams":140}]},{"id":1105073,"name":"Bananas, overripe, raw","cat":"Fruits and Fruit Juices","kcal":85,"protein":0.73,"fat":0.22,"carbs":20.1,"fiber":1.7,"sodium":null,"portions":[{"amount":1,"unit":"Banana","grams":110},{"amount":1,"unit":"serving","grams":140}]},{"id":1105314,"name":"Bananas, ripe and slightly ripe, raw","cat":"Fruits and Fruit Juices","kcal":97,"protein":0.74,"fat":0.29,"carbs":23,"fiber":1.7,"sodium":0,"portions":[{"amount":1,"unit":"Banana","grams":115},{"amount":1,"unit":"serving","grams":140}]},{"id":2644285,"name":"Beans, black, canned, sodium added, drained and rinsed","cat":"Legumes and Legume Products","kcal":118.4,"protein":6.9125,"fat":1.273,"carbs":19.8135,"fiber":null,"sodium":217.9,"portions":[{"amount":1,"unit":"serving","grams":130}]},{"id":2644287,"name":"Beans, cannellini, canned, sodium added, drained and rinsed","cat":"Legumes and Legume Products","kcal":115.4,"protein":7.4125,"fat":1.169,"carbs":18.8185,"fiber":null,"sodium":164,"portions":[{"amount":1,"unit":"serving","grams":130}]},{"id":2644281,"name":"Beans, cannellini, dry","cat":"Legumes and Legume Products","kcal":345.2,"protein":21.5625,"fat":2.199,"carbs":59.7955,"fiber":null,"sodium":0,"portions":[{"amount":1,"unit":"serving","grams":35}]},{"id":2644294,"name":"Beans, great northern, canned, sodium added, drained and rinsed","cat":"Legumes and Legume Products","kcal":116.8,"protein":7.03125,"fat":1.266,"carbs":19.32875,"fiber":null,"sodium":223.1,"portions":[{"amount":1,"unit":"serving","grams":130}]},{"id":2644289,"name":"Beans, kidney, dark red, canned, sodium added, sugar added, drained and rinsed","cat":"Legumes and Legume Products","kcal":126.6,"protein":7.8,"fat":1.256,"carbs":21.03,"fiber":null,"sodium":172.3,"portions":[{"amount":1,"unit":"serving","grams":130}]},{"id":2644290,"name":"Beans, kidney, light red, canned, sodium added, sugar added, drained and rinsed","cat":"Legumes and Legume Products","kcal":126.7,"protein":7.30625,"fat":1.299,"carbs":21.44675,"fiber":null,"sodium":158.5,"portions":[{"amount":1,"unit":"serving","grams":130}]},{"id":2644286,"name":"Beans, navy, canned, sodium added, drained and rinsed","cat":"Legumes and Legume Products","kcal":118.8,"protein":6.56875,"fat":1.398,"carbs":19.98325,"fiber":null,"sodium":190.1,"portions":[{"amount":1,"unit":"serving","grams":130}]},{"id":2644292,"name":"Beans, pinto, canned, sodium added, drained and rinsed","cat":"Legumes and Legume Products","kcal":116.6,"protein":6.69375,"fat":1.266,"carbs":19.60025,"fiber":null,"sodium":201.6,"portions":[{"amount":1,"unit":"serving","grams":130}]},{"id":321611,"name":"Beans, snap, green, canned, regular pack, drained solids","cat":"Vegetables and Vegetable Products","kcal":21,"protein":1.04,"fat":0.39,"carbs":4.11,"fiber":null,"sodium":282,"portions":[{"amount":1,"unit":"cup","grams":129},{"amount":1,"unit":"serving","grams":130}]},{"id":2346400,"name":"Beans, snap, green, raw","cat":"Vegetables and Vegetable Products","kcal":40,"protein":1.96875,"fat":0.275,"carbs":7.41245,"fiber":3.011,"sodium":0,"portions":[{"amount":1,"unit":"serving","grams":85}]},{"id":2646174,"name":"Beef, chuck, roast, boneless, choice, raw","cat":"Beef Products","kcal":231.7,"protein":18.4,"fat":17.8,"carbs":0,"fiber":null,"sodium":48.44,"portions":[{"amount":1,"unit":"serving","grams":114}]},{"id":2646175,"name":"Beef, flank, steak, boneless, choice, raw","cat":"Beef Products","kcal":163.9,"protein":20.13125,"fat":9.399,"carbs":0,"fiber":null,"sodium":51.3,"portions":[{"amount":1,"unit":"serving","grams":114}]},{"id":2514744,"name":"Beef, ground, 80% lean meat / 20% fat, raw","cat":"Beef Products","kcal":242.6,"protein":17.53125,"fat":19.44,"carbs":0,"fiber":null,"sodium":54.94,"portions":[{"amount":1,"unit":"serving","grams":114}]},{"id":2514743,"name":"Beef, ground, 90% lean meat / 10% fat, raw","cat":"Beef Products","kcal":184.9,"protein":18.15625,"fat":12.85,"carbs":0,"fiber":null,"sodium":61.64,"portions":[{"amount":1,"unit":"serving","grams":114}]},{"id":746758,"name":"Beef, loin, tenderloin roast, separable lean only, boneless, trimmed to 0\" fat, select, cooked, roasted","cat":"Beef Products","kcal":176,"protein":27.7,"fat":6.36,"carbs":0,"fiber":null,"sodium":54,"portions":[{"amount":1,"unit":"serving","grams":114},{"amount":1,"unit":"roast","grams":462}]},{"id":746759,"name":"Beef, loin, top loin steak, boneless, lip-on, separable lean only, trimmed to 1/8\" fat, choice, raw","cat":"Beef Products","kcal":155,"protein":22.8,"fat":6.39,"carbs":0,"fiber":null,"sodium":45,"portions":[{"amount":1,"unit":"steak","grams":284}]},{"id":2646172,"name":"Beef, ribeye, steak, boneless, choice, raw","cat":"Beef Products","kcal":254.1,"protein":18.74375,"fat":20.04,"carbs":0,"fiber":null,"sodium":42.54,"portions":[{"amount":1,"unit":"serving","grams":114}]},{"id":746760,"name":"Beef, round, eye of round roast, boneless, separable lean only, trimmed to 0\" fat, select, raw","cat":"Beef Products","kcal":122,"protein":23.4,"fat":2.48,"carbs":0,"fiber":null,"sodium":50,"portions":[{"amount":1,"unit":"serving","grams":114},{"amount":1,"unit":"roast","grams":690}]},{"id":746761,"name":"Beef, round, top round roast, boneless, separable lean only, trimmed to 0\" fat, select, raw","cat":"Beef Products","kcal":123,"protein":23.7,"fat":2.41,"carbs":0,"fiber":null,"sodium":55,"portions":[{"amount":1,"unit":"serving","grams":114},{"amount":1,"unit":"roast","grams":788}]},{"id":2646173,"name":"Beef, round, top round, boneless, choice, raw","cat":"Beef Products","kcal":140.6,"protein":21.475,"fat":5.703,"carbs":0.852,"fiber":null,"sodium":45.54,"portions":[{"amount":1,"unit":"serving","grams":114}]},{"id":2727572,"name":"Beef, short loin (NY strip steak), raw","cat":"Beef Products","kcal":190,"protein":21.325,"fat":11.54,"carbs":0.2212,"fiber":null,"sodium":43.09,"portions":[{"amount":1,"unit":"serving","grams":114}]},{"id":746762,"name":"Beef, short loin, porterhouse steak, separable lean only, trimmed to 1/8\" fat, select, raw","cat":"Beef Products","kcal":145,"protein":22.7,"fat":5.32,"carbs":0,"fiber":null,"sodium":43,"portions":[{"amount":1,"unit":"serving","grams":114},{"amount":1,"unit":"steak","grams":525}]},{"id":746763,"name":"Beef, short loin, t-bone steak, bone-in, separable lean only, trimmed to 1/8\" fat, choice, cooked, grilled","cat":"Beef Products","kcal":219,"protein":27.3,"fat":11.4,"carbs":0,"fiber":null,"sodium":67,"portions":[{"amount":1,"unit":"serving","grams":114},{"amount":1,"unit":"steak","grams":360}]},{"id":2727573,"name":"B